{"type":"config","name":"Auto-generate AI content dataset via MiniMax API","metricName":"files_per_cycle","metricUnit":"files","bestDirection":"higher"}
{"run":1,"commit":"4a52e6f","metric":25,"metrics":{"images":3,"speech":2,"music":1,"text":19,"duration_s":600,"text_failures":1},"status":"keep","description":"Baseline sequential: 3 img + 2 speech + 1 music + 20 text = 25 files in ~600s. Text bottleneck (5s/item). Lock + trap working.","timestamp":1780209642699,"segment":0,"confidence":null,"asi":{"candidate_id":"baseline-seq","family":"architecture","operator":"baseline","images":3,"speech":2,"music":1,"text":20,"parallel":false,"retry":false}}
{"run":2,"commit":"e8f2a1b","metric":21,"metrics":{"images":3,"speech":2,"music":1,"text":15,"duration_s":600,"text_failures":5},"status":"discard","description":"Parallel media saved ~45s but text bottleneck unchanged.21 files in 600s (vs 25 baseline). Text ~34s/item.","timestamp":1780211185948,"segment":0,"confidence":null,"asi":{"candidate_id":"parallel-all","family":"architecture","operator":"parallelize","images":3,"speech":2,"music":1,"text":20,"parallel":true,"retry":false,"parallel_media":true,"files_per_cycle":21,"baseline":25,"verdict":"discard"}}
{"run":3,"commit":"6412fb4","metric":26,"metrics":{"images":3,"speech":2,"music":1,"text":20,"duration_s":339,"text_failures":0},"status":"keep","description":"Parallel text (4 batches of 5) + parallel media: 26 files in 339s (vs baseline 25/600s). 1.77x faster, same quality. Text fully parallelized.","timestamp":1780211606986,"segment":0,"confidence":1,"asi":{"candidate_id":"parallel-all-text","family":"architecture","operator":"combine","images":3,"speech":2,"music":1,"text":20,"parallel":true,"retry":false,"parallel_media":true,"parallel_text":true,"text_batches":4,"files_per_cycle":26,"baseline":25,"speedup":1.77,"verdict":"keep"}}
{"run":4,"commit":"502bc61","metric":26,"metrics":{"images":3,"speech":2,"music":1,"text":20,"duration_s":233,"text_failures":0},"status":"keep","description":"Full overlap (media + text t=0): 26 files in 233s. True concurrency — text starts with media, not after. Lock stale-clean fixed. 1.46x faster than parallel-all-text.","timestamp":1780215109696,"segment":0,"confidence":2,"asi":{"candidate_id":"full-overlap","family":"architecture","operator":"mutate","images":3,"speech":2,"music":1,"text":20,"parallel":true,"retry":false,"parallel_media":true,"parallel_text":true,"text_batches":4,"media_text_overlap":true,"files_per_cycle":26,"baseline":25,"speedup_vs_prev":1.46,"verdict":"keep"}}
{"run":5,"commit":"7bea7d9","metric":53,"metrics":{"images":3,"speech":2,"music":1,"text":47,"duration_s":279,"text_failures":3},"status":"keep","description":"text-heavy-50: 50 topics (5 batches of 10) + full overlap. 53 files in 279s vs full-overlap 26/233s. 2x more files, 46s longer.3 text failures (6%) from rate limiting.","timestamp":1780215479376,"segment":0,"confidence":28,"asi":{"candidate_id":"text-heavy-50","family":"architecture","operator":"mutate","images":3,"speech":2,"music":1,"text":50,"parallel":true,"retry":false,"parallel_media":true,"parallel_text":true,"text_batches":5,"batch_size":10,"media_text_overlap":true,"files_per_cycle":53,"baseline":25,"speedup_vs_prev":2.04,"verdict":"keep"}}
{"run":6,"commit":"fd4fbb2","metric":54,"metrics":{"images":1,"speech":2,"music":1,"text":50,"duration_s":270,"text_failures":0},"status":"keep","description":"retry-resilient-v2: text 3-retry on text-heavy-50. 50/50 text (0 failures) but 2 image rate-limit failures (1/3 img). 54 files in 270s vs text-heavy-50 53/279s. Trade-off: text retry recovers3 but no media retry loses 2. Net +1.","timestamp":1780216291523,"segment":0,"confidence":9.666666666666666,"asi":{"candidate_id":"retry-resilient-v2","family":"architecture","operator":"mutate","images":3,"speech":2,"music":1,"text":50,"retry":true,"retry_attempts":3,"retry_delay":3,"files_per_cycle":54,"baseline":25,"prev_best":53,"delta":1,"verdict":"keep","finding":"filename collision fixed 25->40-char; text retry works perfectly; media retry needed"}}
{"run":7,"commit":"8459f9b","metric":53,"metrics":{"images":0,"speech":2,"music":1,"text":50,"duration_s":304,"text_failures":0},"status":"discard","description":"media-retry-v3: full retry on all generators. 0/3 images (vs 1/3 without retry). Text retry works (50/50). Total53 files in 303s vs retry-resilient-v2 54/270s. Retry on images is COUNTERPRODUCTIVE —9 API calls vs 3 triggers harder rate limit. Only apply retry to fast/cheap generators.","timestamp":1780216678803,"segment":0,"confidence":5.8,"asi":{"candidate_id":"media-retry-v3","family":"architecture","operator":"mutate","images":3,"speech":2,"music":1,"text":50,"retry":true,"media_retry":true,"retry_attempts":3,"files_per_cycle":53,"baseline":25,"prev_best":54,"delta":-1,"verdict":"discard","rollback_reason":"retry on slow/rate-limited generators (images) makes things WORSE; 9 API calls instead of 3 hammers rate limit","next_action":"Remove retry from images; add longer sleep (30s) between images instead; keep text retry only"}}
{"run":8,"commit":"4e8ecba","metric":102,"metrics":{"images":0,"speech":2,"music":1,"text":99,"duration_s":288,"text_failures":1},"status":"keep","description":"text-ultra-100-retry: 100 text topics (10 batches) + text retry only (no media retry). 99/100 text + 2 speech + 1 music = 102 files in 288s vs retry-resilient-v2 54/270s. 89% improvement. Images consistently fail (0/3) — text dominates count so total still excellent.","timestamp":1780217047266,"segment":0,"confidence":5.5,"asi":{"candidate_id":"text-ultra-100-retry","family":"architecture","operator":"mutate","images":3,"speech":2,"music":1,"text":100,"retry":true,"media_retry":false,"text_batches":10,"batch_size":10,"files_per_cycle":102,"baseline":25,"prev_best":54,"delta":89,"verdict":"keep","finding":"text-heavy scales best; 100 text topics = 99 files; images fail consistently but text count absorbs loss; filename collision fixed 25->40 chars; text retry recovers 99/100"}}
